{
  "$schema": "./release-eligibility.schema.json",
  "schemaVersion": 1,
  "recordKind": "omniroute-release-eligibility",
  "release": {
    "repository": "diegosouzapw/OmniRoute",
    "tag": "v3.8.50",
    "commit": "5458026c216f77a3da68ea49152dc33470cfe2cb"
  },
  "default": {
    "status": "unavailable",
    "reason": "No exact pinned-source and behavior evidence is recorded for this operation in the release eligibility contract."
  },
  "operations": [
    {
      "operationId": "GET /api/health",
      "status": "verified",
      "reason": "Pinned handler is an explicit minimal liveness read with no mutation or credential-bearing output.",
      "source": {
        "file": "src/app/api/health/route.ts",
        "sha256": "8101d749c3457d5c750376bdd702ae52fc1044c2008415c989e7b0f87ae3145c",
        "gitBlobSha": "2ead593b7874d7fef374be76dd2d82d5832ba30c"
      },
      "evidence": [
        { "kind": "pinned-source", "detail": "Exact source bytes match the route manifest at OmniRoute commit 5458026c216f77a3da68ea49152dc33470cfe2cb." },
        { "kind": "handler-review", "detail": "The GET handler returns only status and timestamp and performs no request, persistence, or mutation call." },
        { "kind": "fixture", "detail": "Synthetic dispatch acceptance covers this verified operation without contacting a gateway." }
      ],
      "response": {
        "required": ["status", "timestamp"],
        "properties": {
          "status": { "type": "string", "enum": ["ok"] },
          "timestamp": { "type": "string", "format": "date-time" }
        }
      }
    }
  ]
}
